{
  "$schema": "../schemas/peer_review_workflow.v1.schema.json",
  "schema_version": "peer_review_workflow.v1",
  "updated_at": "2026-05-27",
  "policy": "本地审稿工作流采用 contract-first hybrid 方案：普通单篇论文仍走轻量结构化评审；投稿前内审、返修包、顶刊级审查、图表复现审计和用户明确要求多视角讨论时，升级为角色化审稿协议。外部仓库只作为模式来源，不整包接管本地路由、引用核验、Zotero、Obsidian 或复现链。",
  "source_review_refs": [
    {
      "upstream": "qqfly1to19/awesome_proofreading_auto",
      "repo_url": "https://github.com/qqfly1to19/awesome_proofreading_auto",
      "adopted_as": [
        "artifact_issue_ledger",
        "document_element_audit",
        "checkpointed_review_report"
      ]
    },
    {
      "upstream": "c-narcissus/research-review-skill-factory",
      "repo_url": "https://github.com/c-narcissus/research-review-skill-factory",
      "adopted_as": [
        "runtime_literature_context_pack",
        "full_text_reading_gate",
        "subtle_logic_flaw_audit",
        "domain_calibrated_review_watch_layer"
      ]
    },
    {
      "upstream": "Imbad0202/academic-research-skills",
      "repo_url": "https://github.com/Imbad0202/academic-research-skills",
      "adopted_as": [
        "reviewer_configuration_card",
        "multi_perspective_review_panel",
        "re_review_verification"
      ]
    },
    {
      "upstream": "wanshuiyin/Auto-claude-code-research-in-sleep",
      "repo_url": "https://github.com/wanshuiyin/Auto-claude-code-research-in-sleep",
      "adopted_as": [
        "reviewer_independence",
        "zero_context_claim_audit",
        "review_state_resume",
        "human_checkpoint_default"
      ]
    },
    {
      "upstream": "Yuan1z0825/nature-skills",
      "repo_url": "https://github.com/Yuan1z0825/nature-skills",
      "adopted_as": [
        "response_tracker",
        "action_mapping",
        "claim_boundary_review",
        "figure_data_availability_review"
      ]
    },
    {
      "upstream": "Leey21/awesome-ai-research-writing",
      "repo_url": "https://github.com/Leey21/awesome-ai-research-writing",
      "adopted_as": [
        "reviewer-perspective whole-manuscript audit",
        "fatal-versus-fixable weakness distinction",
        "rating or recommendation must have an explicit basis",
        "strategic advice separates root cause, fixability, and concrete action",
        "logic redline check reports only issues that block comprehension or validity"
      ]
    },
    {
      "upstream": "hardikpandya/stop-slop",
      "repo_url": "https://github.com/hardikpandya/stop-slop",
      "adopted_as": [
        "surface slop scan inside writing-structure review",
        "vague declarative and performative emphasis detection",
        "formulaic contrast, negative listing, false agency, and rhythm-monotony checks",
        "directness and density as reviewer-visible prose-quality dimensions"
      ]
    }
  ],
  "adoption_options": [
    {
      "id": "option_a_lightweight_text_patch",
      "label": "只改 skill 文本",
      "decision": "reject_as_default",
      "description": "把外部仓库里的审稿提示词直接写进现有 SKILL.md，不新增协议、schema 或 validator。",
      "upstream_strengths": [
        "上线快",
        "对现有路由影响小",
        "适合一次性口头审稿"
      ],
      "local_risks": [
        "不可验证",
        "不同线程会继续按各自理解执行",
        "返修矩阵和审稿报告没有统一字段",
        "无法阻断伪造修改、伪造引用或空泛润色"
      ]
    },
    {
      "id": "option_b_contract_first_hybrid",
      "label": "协议先行的混合吸收",
      "decision": "selected",
      "description": "先用 schema/catalog 固定审稿模式、触发条件、角色、阶段、报告和红线，再让 academic-paper-review、reviewer-response-pack 和 submission packager 读取同一协议。",
      "upstream_strengths": [
        "吸收专项审校矩阵",
        "吸收领域化 reviewer card",
        "吸收 full-text reading gate",
        "吸收 response tracker 和 action mapping",
        "吸收 zero-context audit 与 reviewer independence"
      ],
      "local_risks": [
        "需要维护一个新 validator",
        "需要把 runtime skill 与 VELA 源规则保持同步",
        "高强度模式可能增加 token 和时间成本"
      ]
    },
    {
      "id": "option_c_default_multi_agent_panel",
      "label": "所有审稿默认多 agent 面板",
      "decision": "reject_as_default",
      "description": "把任何单篇论文评审都拆成 EIC、方法、领域、跨学科、反方和整合者等多个 agent。",
      "upstream_strengths": [
        "覆盖视角最广",
        "适合投稿前大修内审",
        "能显式保留不同 reviewer 的分歧"
      ],
      "local_risks": [
        "违背 single-paper-review 的 never_default_multi_agent 设计",
        "普通审稿成本过高",
        "容易把角色表演误当证据",
        "没有项目材料时会制造过度审稿"
      ]
    },
    {
      "id": "option_d_domain_skill_factory",
      "label": "领域审稿 skill 工厂",
      "decision": "watch",
      "description": "根据某个领域的公开审稿、代表性论文和用户样本生成专属审稿 skill。",
      "upstream_strengths": [
        "能学习领域 reviewer taste",
        "适合长期稳定研究方向",
        "可把近邻文献和 subtle logic flaws 固化为领域规则"
      ],
      "local_risks": [
        "可能泄露私有样本、路径或 reviewer bank",
        "会增加大量 child skill",
        "公开审稿数据在社科领域未必充分",
        "需要单独匿名化和版权边界 validator"
      ]
    },
    {
      "id": "option_e_autonomous_review_fix_loop",
      "label": "自动审稿-修改循环",
      "decision": "partial",
      "description": "让系统按 review -> fix -> re-review 循环自动推进，直到达到预设分数或 gate。",
      "upstream_strengths": [
        "能持续压低明显缺陷",
        "有状态文件和断点恢复",
        "有 reviewer independence 和 trace 纪律"
      ],
      "local_risks": [
        "论文修改、实验补做和引用新增必须保留人工检查点",
        "AI 分数不是投稿就绪证明",
        "社科论文的理论和识别问题不能靠自动改写解决"
      ]
    }
  ],
  "selected_strategy": "option_b_contract_first_hybrid",
  "modes": [
    {
      "id": "standard_single_review",
      "label": "普通单篇论文评审",
      "description": "用于用户要求评审、 critique、方法检查或 referee report，但未要求投稿前多角色内审的单篇论文任务。",
      "default_subagent_policy": "role_simulation_only",
      "trigger_signals": [
        "审稿",
        "review this paper",
        "单篇论文评审",
        "methodology check",
        "referee report"
      ],
      "required_inputs": [
        "target_paper_text_or_pdf",
        "metadata_evidence",
        "access_boundary"
      ],
      "stage_ids": [
        "intake_and_scope",
        "metadata_and_access_gate",
        "artifact_issue_ledger",
        "subtle_logic_flaw_audit",
        "writing_structure_audit",
        "integration_decision"
      ],
      "outputs": [
        "academic_paper_review_report",
        "review_issue_ledger"
      ]
    },
    {
      "id": "top_journal_internal_review",
      "label": "投稿前高强度内审",
      "description": "用于顶刊级审稿、大修前内审、投稿前审查或用户明确要求多视角审稿时。",
      "default_subagent_policy": "conditional_subagents",
      "trigger_signals": [
        "顶刊审稿",
        "投稿前内审",
        "大修前审查",
        "多 reviewer",
        "多视角评审"
      ],
      "required_inputs": [
        "manuscript",
        "figures_tables",
        "references",
        "target_venue_or_review_standard",
        "available_appendix_or_reproducibility_materials"
      ],
      "stage_ids": [
        "intake_and_scope",
        "metadata_and_access_gate",
        "reviewer_configuration",
        "runtime_literature_context_pack",
        "artifact_issue_ledger",
        "independent_role_review",
        "subtle_logic_flaw_audit",
        "writing_structure_audit",
        "integration_decision"
      ],
      "outputs": [
        "reviewer_configuration_card",
        "runtime_literature_context_pack",
        "multi_reviewer_report",
        "revision_priority_map"
      ]
    },
    {
      "id": "revision_response_review",
      "label": "返修与回复审稿",
      "description": "用于已有审稿意见、response letter、修改稿或用户要求核验是否真正回应审稿意见的任务。",
      "default_subagent_policy": "conditional_subagents",
      "trigger_signals": [
        "回复审稿",
        "response letter",
        "rebuttal",
        "revise and resubmit",
        "返修核验"
      ],
      "required_inputs": [
        "editor_decision_letter",
        "reviewer_comments",
        "revised_manuscript_or_change_notes",
        "response_draft_optional"
      ],
      "stage_ids": [
        "intake_and_scope",
        "metadata_and_access_gate",
        "response_tracker_or_re_review",
        "artifact_issue_ledger",
        "writing_structure_audit",
        "integration_decision"
      ],
      "outputs": [
        "reviewer_response_tracker",
        "revision_verification_matrix",
        "response_readiness_report"
      ]
    },
    {
      "id": "submission_package_review",
      "label": "送审包总审",
      "description": "用于论文、图表、引用、代码、数据说明和复现包需要一起冻结的投稿包任务。",
      "default_subagent_policy": "always_multi_agent",
      "trigger_signals": [
        "送审包",
        "投稿包",
        "最终定稿",
        "复现包",
        "submission package"
      ],
      "required_inputs": [
        "manuscript",
        "figures_tables",
        "citation_report",
        "writing_quality_report",
        "reproducibility_materials",
        "package_boundary"
      ],
      "stage_ids": [
        "intake_and_scope",
        "metadata_and_access_gate",
        "artifact_issue_ledger",
        "independent_role_review",
        "writing_structure_audit",
        "integration_decision",
        "package_freeze_check"
      ],
      "outputs": [
        "submission_review_manifest",
        "gate_report",
        "freeze_blocker_list"
      ]
    },
    {
      "id": "domain_calibrated_review",
      "label": "领域校准审稿",
      "description": "用于长期研究方向，只有在有足够领域样本、公开评审或用户提供的高低质量样本时才启用。",
      "default_subagent_policy": "conditional_subagents",
      "trigger_signals": [
        "校准审稿人",
        "领域审稿 skill",
        "reviewer calibration",
        "领域 taste"
      ],
      "required_inputs": [
        "domain_profile",
        "public_review_evidence_or_user_samples",
        "anonymization_plan",
        "validation_prompt_set"
      ],
      "stage_ids": [
        "intake_and_scope",
        "reviewer_configuration",
        "runtime_literature_context_pack",
        "subtle_logic_flaw_audit",
        "integration_decision"
      ],
      "outputs": [
        "domain_reviewer_configuration_card",
        "calibration_limitations",
        "future_skill_proposal"
      ]
    }
  ],
  "trigger_rules": [
    {
      "id": "single_paper_default",